{
  "schema": "ailang.board.bind/v1",
  "board": "tang_nano_9k",
  "bind": {
    "clk": "clk27",
    "Board_led": { "resource": "led", "bits": "5:0" },
    "Board_div": null,
    "Board_tick": null,
    "rst": null
  },
  "policy": {
    "unbound_out": "warn",
    "unbound_in": "warn",
    "emit_wrapper": true
  }
}
